authors	pub_year	title	conference	location	paper_url	accepted	submitted
Phani Vadrevu, Babak Rahbarinia, Roberto Perdisci, Kang Li, Manos Antonakakis	2013	Measuring and detecting malware downloads in live network traffic	European Symposium on Research in Computer Security (ESORICS)	Egham, U.K.	/files/papers/amico.pdf	43	242
Phani Vadrevu, Roberto Perdisci	2016	MAXS: Scaling malware execution with sequential multi-hypothesis testing	11th ACM on Asia Conference on Computer and Communications Security (AsiaCCS)	Xi'an, China	/files/papers/maxs.pdf	73	350
Phani Vadrevu, Jienan Liu, Bo Li, Babak Rahbarinia, Kyu Hyung Lee, Roberto Perdisci	2017	Enabling Reconstruction of Attacks on Users via Efficient Browsing Snapshots	24th Annual Network and Distributed System Security Symposium (NDSS)	San Diego, U.S.A.	/files/papers/chromepic.pdf	68	423
Bo Li, Phani Vadrevu, Kyu Hyung Lee, Roberto Perdisci	2018	JSgraph: Enabling Reconstruction of Web Attacks via Efficient Tracking of Live In-Browser JavaScript Executions	25th Annual Network and Distributed System Security Symposium (NDSS)	San Diego, U.S.A.	/files/papers/jsgraph.pdf	71	331
Phani Vadrevu, Roberto Perdisci	2019	What You See is NOT What You Get: Discovering and Tracking Ad-Driven Social Engineering 10 Attack Campaigns	19th ACM Internet Measurement Conference (IMC)	Amsterdam, Netherlands	/files/papers/seacma.pdf	38	197
Karthika Subramani, Xingzi Yuan, Omid Setayeshfar, Phani Vadrevu, Kyu Hyung Lee, Roberto Perdisci	2020	Measuring Abuse in Web Push Advertising	arXiv preprint	-	/files/papers/pushads.pdf	-	-
